{
  "schema": "yb.explain.v2",
  "scope": "district.summary",
  "district_label": "District A",
  "priority_band": "critical",
  "confidence_band": "high",
  "snapshot_freshness": "live_on_cycle",
  "dispatch_candidate_count": 2,
  "resource_plan": {
    "motorcycle_tasks": 1,
    "truck_tasks": 1
  },
  "reason_tags": [
    "historical_baseline_deviation",
    "weather_context",
    "commute_window"
  ],
  "policy_boundary": {
    "bedrock_role": "explain_only",
    "dispatch_decision_source": "local_private_algorithm",
    "do_not_decide_dispatch": true,
    "raw_data_sent": false,
    "location_data_sent": false,
    "identity_data_sent": false
  }
}
